En la metamorfosis de un insecto, la pupa es...	Un estado posterior al de larva	El estado previo al de larva	El momento en que se rompe la crisálida	La pupa es el estado que lleva de larva a adulto. La descubridora fue Maria Sibylla Merian, la primera especialista en insectos que observó el proceso de metamorfosis. 	La pupa es el estado que lleva de larva a adulto. La descubridora fue Maria Sibylla Merian, la primera especialista en insectos que observó el proceso de metamorfosis. 	La pupa es el estado que lleva de larva a adulto. La descubridora fue Maria Sibylla Merian, la primera especialista en insectos que observó el proceso de metamorfosis. 	pupa.jpg	
Sue, el fósil de Tyrannosaurus rex más completo encontrado, mide... 	12 metros de largo y debió de pesar unas 10 toneladas	6 metros de anchura y debía de pesar 5 toneladas	24 metros de largo y debía de pesar 1000 toneladas	El esqueleto "Sue" fue encontrado por la paleontóloga Sue Hendrickson en 1990, en Dakota (USA). 	El esqueleto "Sue" fue encontrado por la paleontóloga Sue Hendrickson en 1990, en Dakota (USA). 	El esqueleto "Sue" fue encontrado por la paleontóloga Sue Hendrickson en 1990, en Dakota (USA). 	https://bloximages.chicago2.vip.townnews.com/nwitimes.com/content/tncms/assets/v3/editorial/c/be/cbeca802-484a-5436-b4b7-66eb306f8955/cbeca802-484a-5436-b4b7-66eb306f8955.image.jpg	
¿Cuándo decimos que se da epistasis?	Cuando la expresión de uno o más genes dependen de la expresión de otro gen	Cuando un solo gen determina la expresión de una característica	Cuando las células están programadas para morir	El trabajo de investigación de rasgos hereditarios con ratones de la bióloga Florence Margaret Durham fue uno de los primeros ejemplos de epistasis. 	El trabajo de investigación de rasgos hereditarios con ratones de la bióloga Florence Margaret Durham fue uno de los primeros ejemplos de epistasis. 	El trabajo de investigación de rasgos hereditarios con ratones de la bióloga Florence Margaret Durham fue uno de los primeros ejemplos de epistasis. 	http://moderndayms.com/wp-content/uploads/2017/06/maxresdefault-1024x819.jpg	
¿Cuántas especies de Drosophila existen?	Al menos 1500	Al menos 150	Solo una	Drosophila es un género de moscas pequeñas, llamadas frecuentemente «moscas de la fruta» en referencia a su afición a estar cerca de fruta madura. La bióloga catalana María Monclús Barberá era especialista en ellas y descubrió dos especies nuevas. 	Drosophila es un género de moscas pequeñas, llamadas frecuentemente «moscas de la fruta» en referencia a su afición a estar cerca de fruta madura. La bióloga catalana María Monclús Barberá era especialista en ellas y descubrió dos especies nuevas. 	Drosophila es un género de moscas pequeñas, llamadas frecuentemente «moscas de la fruta» en referencia a su afición a estar cerca de fruta madura. La bióloga catalana María Monclús Barberá era especialista en ellas y descubrió dos especies nuevas. 	https://upload.wikimedia.org/wikipedia/commons/2/22/Drosophila.jpg	
¿A qué ritmo se expande la dorsal Mesoatlántica?	2 centímetros por año	2 metros por año	2 kilómetros por año	Marie Tharp creó el primer mapa científico del suelo oceánico en 1957. Demostró la existencia de la dorsal mesoatlántica y supuso una de las pruebas más contundentes de la deriva continental.	Marie Tharp creó el primer mapa científico del suelo oceánico en 1957. Demostró la existencia de la dorsal mesoatlántica y supuso una de las pruebas más contundentes de la deriva continental.	Marie Tharp creó el primer mapa científico del suelo oceánico en 1957. Demostró la existencia de la dorsal mesoatlántica y supuso una de las pruebas más contundentes de la deriva continental.	https://upload.wikimedia.org/wikipedia/commons/thumb/c/ce/Atlantic_bathymetry.jpg/220px-Atlantic_bathymetry.jpg	
¿Qué son las células madre?	Células que pueden diferenciarse en distintos tipos de células especializadas	Las células de los cromosomas X	Las células que se forman en los ovarios antes de la menstruación	Gail Martin, bióloga, descubrió cómo aislar células madre de embriones y mantenerlas vivas in-vitro. 	Gail Martin, bióloga, descubrió cómo aislar células madre de embriones y mantenerlas vivas in-vitro. 	Gail Martin, bióloga, descubrió cómo aislar células madre de embriones y mantenerlas vivas in-vitro. 	https://i2.wp.com/indusdictum.com/wp-content/uploads/2018/01/stem-cell-research.jpg	
¿Qué son los coprolitos?	Heces fosilizadas	Un tipo de piedra volcánica	Un tipo de hongos	Los coprolitos ("piedras de caca") fueron descritos por primera vez en 1829 por William Buckland, basándose en observaciones previas de Mary Anning, una de las "cazadoras" de fósiles más importantes. Antes se pensaba que era un tipo de piedras. 	Los coprolitos ("piedras de caca") fueron descritos por primera vez en 1829 por William Buckland, basándose en observaciones previas de Mary Anning, una de las "cazadoras" de fósiles más importantes. Antes se pensaba que era un tipo de piedras. 	Los coprolitos ("piedras de caca") fueron descritos por primera vez en 1829 por William Buckland, basándose en observaciones previas de Mary Anning, una de las "cazadoras" de fósiles más importantes. Antes se pensaba que era un tipo de piedras. 	MaryAnning.jpg	
¿Qué es la técnica CRISPR/Cas 9?	Una técnica de edición genética	Una técnica no invasiva para operar el corazón	Una técnica para hacer más crujientes los cereales	Jennifer Doudna es una de las descubridoras de CRISPR, una técnica para hacer un "corta y pega" del ADN que podría permitir curar ciertas enfermedades.	Jennifer Doudna es una de las descubridoras de CRISPR, una técnica para hacer un "corta y pega" del ADN que podría permitir curar ciertas enfermedades.	Jennifer Doudna es una de las descubridoras de CRISPR, una técnica para hacer un "corta y pega" del ADN que podría permitir curar ciertas enfermedades.	jennifer.jpg	
¿Importa el tamaño de los telómeros?	Es mejor que sean largos	Cuanto más cortos mejor	El tamaño no importa	Según las células envejecen los telómeros (los extremos de los cromosomas) se van acortando, hasta que los cromosomas se vuelven demasiado cortos y ya no pueden replicarse más: la célula ya no se podrá reproducir. Lo descubrió la Nobel  Elizabeth Blackburn.	Según las células envejecen los telómeros (los extremos de los cromosomas) se van acortando, hasta que los cromosomas se vuelven demasiado cortos y ya no pueden replicarse más: la célula ya no se podrá reproducir. Lo descubrió la Nobel Elizabeth Blackburn.	Según las células envejecen los telómeros (los extremos de los cromosomas) se van acortando, hasta que los cromosomas se vuelven demasiado cortos y ya no pueden replicarse más: la célula ya no se podrá reproducir. Lo descubrió la Nobel Elizabeth Blackburn.	Xchromosomesm.jpg	
¿Qué es la telomerasa?	Una enzima que permite el alargamiento de los telómeros	Una enzima que permite el acortamiento de los telómeros	Una bacteria que destruye a los telómeros	La telomerasa fue descubierta por las Nobel Elizabeth Blackburn y Carol Greider. Se trata de una enzima de las células que las ayuda a mantenerse vivas al agregar ADN a los telómeros (los extremos de los cromosomas).	La telomerasa fue descubierta por las Nobel Elizabeth Blackburn y Carol Greider. Se trata de una enzima de las células que las ayuda a mantenerse vivas al agregar ADN a los telómeros (los extremos de los cromosomas).	La telomerasa fue descubierta por las Nobel Elizabeth Blackburn y Carol Greider. Se trata de una enzima de las células que las ayuda a mantenerse vivas al agregar ADN a los telómeros (los extremos de los cromosomas).	BlackburnGreider.jpg	
¿Sobre qué alerta el libro "la primavera silenciosa"?	El peligro del uso indiscriminado de los pesticidas	El peligro del cambio climático	El peligro de la contaminación	El libro de Rachel Carlson es uno de los primeros de divulgación sobre impacto ambiental. Alertaba especialmente de los peligros del pesticida DDT.	El libro de Rachel Carlson es uno de los primeros de divulgación sobre impacto ambiental. Alertaba especialmente de los peligros del pesticida DDT.	El libro de Rachel Carlson es uno de los primeros de divulgación sobre impacto ambiental. Alertaba especialmente de los peligros del pesticida DDT.	rachelCarson.jpg	
En el caso de los escarabajos, ¿qué cromosoma determina que sean machos?	El Y	El X	No hay machos	Nettie Stevens fue la primera en describir las bases cromosómicas que determinan el sexo, basándose en sus estudios con escarabajos. 	Nettie Stevens fue la primera en describir las bases cromosómicas que determinan el sexo, basándose en sus estudios con escarabajos. 	Nettie Stevens fue la primera en describir las bases cromosómicas que determinan el sexo, basándose en sus estudios con escarabajos. 	escarabajo.jpg	
¿Cuántas especies de pájaros hay?	Unas 10000	Unas 5000	Unas 50000	Phoebe Snetsinger fue una ornitóloga famosa por haber observado y descrito más de 8300 diferentes especies de aves (se conocen 10000). Es la persona que más especies de pájaros ha observado. 	Phoebe Snetsinger fue una ornitóloga famosa por haber observado y descrito más de 8300 diferentes especies de aves (se conocen 10000). Es la persona que más especies de pájaros ha observado. 	Phoebe Snetsinger fue una ornitóloga famosa por haber observado y descrito más de 8300 diferentes especies de aves (se conocen 10000). Es la persona que más especies de pájaros ha observado. 	https://i2.wp.com/meowlogy.com/wp-content/uploads/2018/01/30Funny-Birds-.jpg	
¿A partir de que edad se dejan de generar neuronas?	Nunca	A los 30 años	A los 60 años	Elizabeth Gould mostró indicios de que durante toda la vida se crean nuevas neuronas en el hipocampo, la región del cerebro encargada de los recuerdos. 	Elizabeth Gould mostró indicios de que durante toda la vida se crean nuevas neuronas en el hipocampo, la región del cerebro encargada de los recuerdos. 	Elizabeth Gould mostró indicios de que durante toda la vida se crean nuevas neuronas en el hipocampo, la región del cerebro encargada de los recuerdos. 	117233951-neurons.jpg	
								
								
Medicina								
La tos ferina es una enfermedad causada por...	Una bacteria	Un virus	Una mutación	La tos ferina está causada por la bacteria Bordetella pertussis. La co-descubridora de una vacuna contra la tos ferina fue la pediatra danesa Leila Denmark.	La tos ferina está causada por la bacteria Bordetella pertussis. La co-descubridora de una vacuna contra la tos ferina fue la pediatra danesa Leila Denmark.	La tos ferina está causada por la bacteria Bordetella pertussis. La co-descubridora de una vacuna contra la tos ferina fue la pediatra danesa Leila Denmark.	https://i.pinimg.com/originals/8c/db/e5/8cdbe5147375c4fb9db6a8d190202490.jpg	
¿De qué especie viene el virus VIH-1, uno de los causantes del SIDA?	De chimpancés	De murciélagos	De mosquitos	Beatrice H. Hahn fue la investigadora que demostró que la procedencia del VIH-1 era una subespecie de chimpancés. El otro virus, VIH-2, proviene de monos.  	Beatrice H. Hahn fue la investigadora que demostró que la procedencia del VIH-1 era una subespecie de chimpancés. El otro virus, VIH-2, proviene de monos.  	Beatrice H. Hahn fue la investigadora que demostró que la procedencia del VIH-1 era una subespecie de chimpancés. El otro virus, VIH-2, proviene de monos.  	https://janegoodall.ca/wp-content/uploads/2017/04/Petit-Prince-June.jpg	
¿De qué especie viene el parásito que causa la malaria en humanos?	Del gorila	Del mosquito	Del murciélago	Beatrice H. Hahn fue la investigadora que demostró que el parásito P. falciparum fue transmitido a los humanos desde gorilas.	Beatrice H. Hahn fue la investigadora que demostró que el parásito P. falciparum fue transmitido a los humanos desde gorilas.	Beatrice H. Hahn fue la investigadora que demostró que el parásito P. falciparum fue transmitido a los humanos desde gorilas.	http://i.dailymail.co.uk/i/pix/2017/07/04/09/420353C400000578-4663964-image-m-26_1499157720170.jpg	
¿Qué es la candidiasis?	Una infección por levaduras	La adicción a Candy Crush	Una infección bacteriana	La candidiasis en una infección causada por cualquiera de las levaduras Candida. Para tratarla se usan fungicidas. Uno de los primeros descubiertos que se podía utilizar con personas fue por la microbióloga Elizabeth Lee Hazen y la química Rachel Fuller Brown. 	La candidiasis en una infección causada por cualquiera de las levaduras Candida. Para tratarla se usan fungicidas. Uno de los primeros descubiertos que se podía utilizar con personas fue por la microbióloga Elizabeth Lee Hazen y la química Rachel Fuller Brown. 	La candidiasis en una infección causada por cualquiera de las levaduras Candida. Para tratarla se usan fungicidas. Uno de los primeros descubiertos que se podía utilizar con personas fue por la microbióloga Elizabeth Lee Hazen y la química Rachel Fuller Brown. 	https://mujeresconciencia.com/app/uploads/2014/11/Elizabeth_Lee_Hazen_Rachel_Fuller_Brown_1950s.jpg	
El SIDA se debe a...	Un virus	Una bacteria	Células sanguíneas	Françoise Barré-Sinoussi ganó el Nobel en 2008 por el descubrimiento del VIH, el virus causante del SIDA.	Françoise Barré-Sinoussi ganó el Nobel en 2008 por el descubrimiento del VIH, el virus causante del SIDA.	Françoise Barré-Sinoussi ganó el Nobel en 2008 por el descubrimiento del VIH, el virus causante del SIDA.	https://errequerreblog.files.wordpress.com/2013/06/francoise_barre-sinoussi.jpg	
¿Quién desmontó el mito de que el autismo era debido a "madres frías"?	Isabelle Rapin	Emma Watson	Meredith Grey	Isabelle Rapin dedicó décadas al estudio de los problemas de comunicación durante la infancia, especializándose en el espectro autista. 	Isabelle Rapin dedicó décadas al estudio de los problemas de comunicación durante la infancia, especializándose en el espectro autista. 	Isabelle Rapin dedicó décadas al estudio de los problemas de comunicación durante la infancia, especializándose en el espectro autista. 	https://images-na.ssl-images-amazon.com/images/I/51RD56APCML._SX356_BO1,204,203,200_.jpg	
La deficiencia de yodo puede llevar a...	Desarrollar bocio	Desarrollar autismo	Desarrollar Alzheimer	Gabriela Morreale de Escobar, endocrinóloga española, demostró en su tesis la relación entre la falta de yodo y el aumento del tamaño de la glándula tiroidea. 	Gabriela Morreale de Escobar, endocrinóloga española, demostró en su tesis la relación entre la falta de yodo y el aumento del tamaño de la glándula tiroidea. 	Gabriela Morreale de Escobar, endocrinóloga española, demostró en su tesis la relación entre la falta de yodo y el aumento del tamaño de la glándula tiroidea. 	https://4.bp.blogspot.com/-PDgEXp7ufv8/VxotFWfJ-9I/AAAAAAAAXHI/zjLonGBv4yc4ggDHRgfTE7Z-mtwo91coQCLcB/s640/gabriela-morreale.jpg	
¿Para qué sirve la prueba del talón? 	Para detectar de forma precoz enfermedades en bebés	Para detectar trastornos neurodegenerativos en personas mayores	Para detectar trastornos de crecimiento en adolescentes	Gabriela Morreale implantó en España esta técnica de detección precoz de enfermedades en recién nacidos tomando una muestra de sangre del talón.	Gabriela Morreale implantó en España esta técnica de detección precoz de enfermedades en recién nacidos tomando una muestra de sangre del talón.	Gabriela Morreale implantó en España esta técnica de detección precoz de enfermedades en recién nacidos tomando una muestra de sangre del talón.	http://www.leonoticias.com/noticias/201611/21/media/talon.jpg	
¿Qué es el test de Apgar?	Un test para recién nacidos	Un test para diagnosticar cáncer de mama	Un test diagnóstico para el síndrome de Asperger	Es un test para evaluar la salud de los recién nacidos. Fue diseñado por la pediatra Virginia Apgar en 1953 y se sigue usando. 	Es un test para evaluar la salud de los recién nacidos. Fue diseñado por la pediatra Virginia Apgar en 1953 y se sigue usando. 	Es un test para evaluar la salud de los recién nacidos. Fue diseñado por la pediatra Virginia Apgar en 1953 y se sigue usando. 	VirginiaApgar.jpg	
¿Puede ser el cáncer de mama hereditario?	Sí, un pequeño porcentaje de los casos	Sí, un gran porcentaje de los casos	No	Mary-Claire King demostró en 1990 que el gen BRCA1 podría ser responsable de hasta un 10% de los cánceres de mama. Su descubrimiento revolucionó la investigación sobre varias enfermedades. 	Mary-Claire King demostró en 1990 que el gen BRCA1 podría ser responsable de hasta un 10% de los cánceres de mama. Su descubrimiento revolucionó la investigación sobre varias enfermedades. 	Mary-Claire King demostró en 1990 que el gen BRCA1 podría ser responsable de hasta un 10% de los cánceres de mama. Su descubrimiento revolucionó la investigación sobre varias enfermedades. 	https://static01.nyt.com/images/2015/04/21/business/breast1/breast1-blog427.jpg	
Una de las terapias contra en cáncer de mama se basa en...	El bloqueo de la producción de estrógeno	El aumento de la producción de estrógeno	El bloque de la producción de insulina	Angela M. Hartley Brodie fue la desarrolladora de una nueva terapia contra el cáncer de mama basada en "inhibidores de aromatasa" que bloquean la producción de estrógenos.	Angela M. Hartley Brodie fue la desarrolladora de una nueva terapia contra el cáncer de mama basada en "inhibidores de aromatasa" que bloquean la producción de estrógenos.	Angela M. Hartley Brodie fue la desarrolladora de una nueva terapia contra el cáncer de mama basada en "inhibidores de aromatasa" que bloquean la producción de estrógenos.	http://media.springernature.com/m685/nature-static/assets/v1/image-assets/548032a-i1.jpg	
¿Cuándo se consiguió hacer un mapa del  VIH, causante del sida?	En 1985	En 2005	En 2015	Flossie Wong-Staal fue la primera en clonar el VIH y hacer una mapa de todos sus genes, lo que permitió avanzar en la investigación y poder detectarlo con tests en sangre.	Flossie Wong-Staal fue la primera en clonar el VIH y hacer una mapa de todos sus genes, lo que permitió avanzar en la investigación y poder detectarlo con tests en sangre.	Flossie Wong-Staal fue la primera en clonar el VIH y hacer una mapa de todos sus genes, lo que permitió avanzar en la investigación y poder detectarlo con tests en sangre.	vih.jpg	
¿Cuál de estas enfermedades no está relacionada con proteínas "mal dobladas"?	Anemia	Enfermedad de las vacas locas	Alzheimer	Susan Lindquist era una experta en el estudio de las distintas formas que pueden adoptar su proteína y su relación con enfermedades como Parkinson, Alzheimer, Huntington...	Susan Lindquist era una experta en el estudio de las distintas formas que pueden adoptar su proteína y su relación con enfermedades como Parkinson, Alzheimer, Huntington...	Susan Lindquist era una experta en el estudio de las distintas formas que pueden adoptar su proteína y su relación con enfermedades como Parkinson, Alzheimer, Huntington...	dna.jpg	
¿Puede la leucemia ser causada por mutaciones?	Sí	No	Aún no lo sabemos	Janet Rowley descubrió que mutaciones en algunos genes llevan a ciertos tipos de leucemia, lo que llevó a nuevos tratamientos. 	Janet Rowley descubrió que mutaciones en algunos genes llevan a ciertos tipos de leucemia, lo que llevó a nuevos tratamientos. 	Janet Rowley descubrió que mutaciones en algunos genes llevan a ciertos tipos de leucemia, lo que llevó a nuevos tratamientos. 	janet.jpg	
La diabetes de tipo II está relacionada con...	La resistencia a la insulina	Mal funcionamiento del riñón	Un bazo superactivo	Rosalyn Sussman Yalow se llevó en Premio Nobel de Medicina por la creación del radioinmunoanálisis. Esta técnica le permitió ahondar en las causas de la diabetes II y se usó para la investigación de muchas enfermedades.	Rosalyn Sussman Yalow se llevó en Premio Nobel de Medicina por la creación del radioinmunoanálisis. Esta técnica le permitió ahondar en las causas de la diabetes II y se usó para la investigación de muchas enfermedades.	Rosalyn Sussman Yalow se llevó en Premio Nobel de Medicina por la creación del radioinmunoanálisis. Esta técnica le permitió ahondar en las causas de la diabetes II y se usó para la investigación de muchas enfermedades.	https://upload.wikimedia.org/wikipedia/commons/thumb/3/3d/Rosalyn_Yalow.jpg/220px-Rosalyn_Yalow.jpg	
¿Qué es el síndrome del bebé azul?	Bebés con piel azulada por falta de oxígeno	Bebés con piel azulada por falta de melanina	Bebés con pelo azul por falta de melanina	Helen Brooke Taussig, fundadora de la cardiología pediátrica, estudió este síndrome y desarrolló un tratamiento quirúrgico. 	Helen Brooke Taussig, fundadora de la cardiología pediátrica, estudió este síndrome y desarrolló un tratamiento quirúrgico. 	Helen Brooke Taussig, fundadora de la cardiología pediátrica, estudió este síndrome y desarrolló un tratamiento quirúrgico. 	http://acurator.com/blog/Karsh_Taussig_Helen.jpg	
Durante la guerra de Crimea (1853) la principal causa de muerte de los soldados heridos fue...	Enfermedades como tifus y cólera	Heridas de guerra	Suicidio	Florence Nightingale, enfermera y estadística, investigó las causas y presionó para que se mejoraran las condiciones higiénicas de los heridos. También fundó la primera escuela de enfermería (no religiosa).	Florence Nightingale, enfermera y estadística, investigó las causas y presionó para que se mejoraran las condiciones higiénicas de los heridos. También fundó la primera escuela de enfermería (no religiosa).	Florence Nightingale, enfermera y estadística, investigó las causas y presionó para que se mejoraran las condiciones higiénicas de los heridos. También fundó la primera escuela de enfermería (no religiosa).	https://upload.wikimedia.org/wikipedia/commons/thumb/b/ba/Florence_Nightingale._Coloured_lithograph._Wellcome_V0006579.jpg/240px-Florence_Nightingale._Coloured_lithograph._Wellcome_V0006579.jpg	
¿Qué es la transmisión cruzada de infecciones?	Infección desde un paciente a otros pacientes o personal sanitario	La transmisión de enfermedades de madres a sus bebés	Cuando dos infecciones se reproducen y dan lugar a una nueva infección	Ida Ørskov fue la primera que hizo un estudio científico del riesgo mostrando el riesgo del contagio de infecciones entre pacientes y personal sanitario en hospitales.	Ida Ørskov fue la primera que hizo un estudio científico del riesgo mostrando el riesgo del contagio de infecciones entre pacientes y personal sanitario en hospitales.	Ida Ørskov fue la primera que hizo un estudio científico del riesgo mostrando el riesgo del contagio de infecciones entre pacientes y personal sanitario en hospitales.	house.jpg	
¿Cuál es la principal causa de problemas en los trasplantes?	Rechazo inmunológico	Infecciones durante la operación	El órgano donado no estaba en buen estado	La bióloga Els Goulmy es una experta en el área de "los antígenos menores de histocompatibilidad" que pueden llevar al rechazo de transplantes. 	La bióloga Els Goulmy es una experta en el área de "los antígenos menores de histocompatibilidad" que pueden llevar al rechazo de transplantes. 	La bióloga Els Goulmy es una experta en el área de "los antígenos menores de histocompatibilidad" que pueden llevar al rechazo de transplantes. 	antigen.jpg	
¿Cuál de estos tratamientos se puede utilizar contra la leucemia?	Un trasplante de médula ósea	Un transplante de bazo	Un trasplante de las glándulas endocrinas	Dottie Thomas y su marido fueron los pioneros en la investigación contra la leucemia y el desarrollo de los trasplantes de médula ósea. Por ello le dieron a él el Nobel de Medicina. (¿Eres ya donante de médula?)	Dottie Thomas y su marido fueron los pioneros en la investigación contra la leucemia y el desarrollo de los trasplantes de médula ósea. Por ello le dieron a él el Nobel de Medicina. (¿Eres ya donante de médula?)	Dottie Thomas y su marido fueron los pioneros en la investigación contra la leucemia y el desarrollo de los trasplantes de médula ósea. Por ello le dieron a él el Nobel de Medicina. (¿Eres ya donante de médula?)	https://static.seattletimes.com/wp-content/uploads/2015/01/2025434580-300x0.jpg	
								
								
Tecnología								
¿Cuándo se hizo el primer programa de ordenador?	1842	1912	1945	En 1842 Ada Lovelace publicó un algoritmo para computar los números de Bernoulli en la "Máquina Analítica" de Babbage.	En 1842 Ada Lovelace publicó un algoritmo para computar los números de Bernoulli en la "Máquina Analítica" de Babbage.	En 1842 Ada Lovelace publicó un algoritmo para computar los números de Bernoulli en la "Máquina Analítica" de Babbage.	https://carteleradehistoria2.files.wordpress.com/2014/10/ay95895977ada-lovelace-engl.jpg	
¿Quién inventó el término "ingeniería de software"?	Margaret Hamilton	Alan Turing	Ada Lovelace	Margaret Hamilton fue la responsable del software de vuelo del Apolo XI, con el que se llegó a la Luna. El código escrito por ella y su equipo está disponible en internet.	Margaret Hamilton fue la responsable del software de vuelo del Apolo XI, con el que se llegó a la Luna. El código escrito por ella y su equipo está disponible en internet.	Margaret Hamilton fue la responsable del software de vuelo del Apolo XI, con el que se llegó a la Luna. El código escrito por ella y su equipo está disponible en internet.	https://upload.wikimedia.org/wikipedia/commons/d/db/Margaret_Hamilton_-_restoration.jpg	
