¿Quién consiguió crear por primera vez elementos radiactivos? ☢	Irène Joliot-Curie	Marie Curie	Lise Meitner	Irène Joliot-Curie y su marido Frédéric fueron los primeros en convertir un elemento en otro a través de la radiactividad. Por ello recibieron el Nobel en 1935.	Irène Joliot-Curie y su marido Frédéric fueron los primeros en convertir un elemento en otro a través de la radiactividad. Por ello recibieron el Nobel en 1935.	Irène Joliot-Curie y su marido Frédéric fueron los primeros en convertir un elemento en otro a través de la radiactividad. Por ello recibieron el Nobel en 1935.	https://upload.wikimedia.org/wikipedia/commons/a/aa/Irene_and_Marie_Curie_1925.jpg	
¿Qué permite el Baño María?	Calentar algo de forma indirecta	Limpiar los pecados	Hervir un líquido rápidamente	El Baño María consiste en meter un recipiente dentro de otro más grande con un líquido. Calienta por igual y de forma controlada el contenido del recipiente pequeño. Se llama así por María de Alejandría (s. III), la primera persona alquimista de occidente.	El Baño María consiste en meter un recipiente dentro de otro más grande con un líquido. Calienta por igual y de forma controlada el contenido del recipiente pequeño. Se llama así por María de Alejandría (s. III), la primera persona alquimista de occidente.	El Baño María consiste en meter un recipiente dentro de otro más grande con un líquido. Calienta por igual y de forma controlada el contenido del recipiente pequeño. Se llama así por María de Alejandría (s. III), la primera persona alquimista de occidente.	maria-judia2.jpg	
¿Qué son los diagramas de Richardson?	La representación en 3D de proteínas	La representación virtual de bacterias	La representación en 2D de proteínas	Jane Shelby Richardson utilizó sus conocimientos en varias disciplinas para crear una representación tridimensional de las proteínas que nos permite entender mejor su función.	Jane Shelby Richardson utilizó sus conocimientos en varias disciplinas para crear una representación tridimensional de las proteínas que nos permite entender mejor su función.	Jane Shelby Richardson utilizó sus conocimientos en varias disciplinas para crear una representación tridimensional de las proteínas que nos permite entender mejor su función.	https://upload.wikimedia.org/wikipedia/commons/thumb/f/ff/Tubby-1c8z-pymol.png/800px-Tubby-1c8z-pymol.png	
¿Qué es la azatioprina?	Un fármaco inmunosupresor	Un fármaco contra el VIH	Un fármaco contra la gripe	La azatioprina fue el primer fármaco inmunosupresor que se desarrolló e inicialmente se usaba antes de transplantes. Gertrude Elion se llevó el Nobel por este trabajo y el desarrollo de otros muchos fármacos. 	La azatioprina fue el primer fármaco inmunosupresor que se desarrolló e inicialmente se usaba antes de transplantes. Gertrude Elion se llevó el Nobel por este trabajo y el desarrollo de otros muchos fármacos.	La azatioprina fue el primer fármaco inmunosupresor que se desarrolló e inicialmente se usaba antes de transplantes. Gertrude Elion se llevó el Nobel por este trabajo y el desarrollo de otros muchos fármacos.	https://www.thefamouspeople.com/profiles/images/gertrude-b-elion-3.jpg	
¿En qué se basó el primer tratamiento efectivo contra la malaria? 💊	En compuestos sintetizados a partir de la artemisina	En compuestos sintetizados a partir de la quinina	En compuestos sintetizados a partir de la corteza del sauce	YouYou Tu, premio nobel de medicina, fue la descubridora del primer tratamiento efectivo contra la malaria.	YouYou Tu, premio nobel de medicina, fue la descubridora del primer tratamiento efectivo contra la malaria.	YouYou Tu, premio nobel de medicina, fue la descubridora del primer tratamiento efectivo contra la malaria.	https://www.nobelprize.org/nobel_prizes/medicine/laureates/2015/tu_postcard.jpg	
¿Cuándo se fabricó el primer antibiótico (por síntesis química)?	1949	1989	1890	Mildred Catherine Rebstock fue la primera en desarrollar por síntesis química un antibiótico (cloranfenicol), lo que permitió su producción masiva. Actualmente se usa sobre todo contra la cólera y la meningitis.	Mildred Catherine Rebstock fue la primera en desarrollar por síntesis química un antibiótico (cloranfenicol), lo que permitió su producción masiva. Actualmente se usa sobre todo contra la cólera y la meningitis.	Mildred Catherine Rebstock fue la primera en desarrollar por síntesis química un antibiótico (cloranfenicol), lo que permitió su producción masiva. Actualmente se usa sobre todo contra la cólera y la meningitis.	https://thumbs.ebaystatic.com/d/l225/m/mlKJGOD2t3wgHbfnrjQ5mXQ.jpg	
¿Qué efecto tienen las drogas basadas en alcaloides de la vinca?	Inhiben la división de las células tumorales	Inhiben la caída del cabello	Alivian el dolor de las hemorroides	Los alcaloides de la vinca son usados en el tratamiento del cáncer. Originalmente se extraían de la planta vinca de Madagascar y una de las pioneras en su estudio fue la química india Asima Chatterjee.	Los alcaloides de la vinca son usados en el tratamiento del cáncer. Originalmente se extraían de la planta vinca de Madagascar y una de las pioneras en su estudio fue la química india Asima Chatterjee.	Los alcaloides de la vinca son usados en el tratamiento del cáncer. Originalmente se extraían de la planta vinca de Madagascar y una de las pioneras en su estudio fue la química india Asima Chatterjee.	https://pbs.twimg.com/media/DKY4ZXDWkAA-B4l.jpg	
La estructura de los ribosomas se pudo descubrir con...	Cristalografía de rayos X	Un microscopio basado en antimateria	Un ribosometro	Ada Yonath pasó décadas estudiando la estructura de los ribosomas por lo que le concedieron un Nobel. Entre otras muchas aplicaciones está el desarrollo de nuevos antibióticos. 	Ada Yonath pasó décadas estudiando la estructura de los ribosomas por lo que le concedieron un Nobel. Entre otras muchas aplicaciones está el desarrollo de nuevos antibióticos. 	Ada Yonath pasó décadas estudiando la estructura de los ribosomas por lo que le concedieron un Nobel. Entre otras muchas aplicaciones está el desarrollo de nuevos antibióticos. 	yonath_red.jpg	
El citrato puede estar relacionado con...	Problemas en los huesos	Las agujetas	Las migrañas	La química Melinda Duer estudia la estructura interna de los huesos y el papel del citrato (un subproducto del metabolismo celular) en su ruptura. 	La química Melinda Duer estudia la estructura interna de los huesos y el papel del citrato (un subproducto del metabolismo celular) en su ruptura. 	La química Melinda Duer estudia la estructura interna de los huesos y el papel del citrato (un subproducto del metabolismo celular) en su ruptura. 	bones.jpg	
¿Es bueno o malo que el ozono se destruya en la troposfera?	Bueno	Malo	Neutro	Mientras sea en la troposfera es bueno porque en esta zona el ozono contribuye al efecto invernadero. Lucy Carpenter investiga el ciclo océano-atmósfera y las moléculas que juegan un papel en él.	Mientras sea en la troposfera es bueno porque en esta zona el ozono contribuye al efecto invernadero. Lucy Carpenter investiga el ciclo océano-atmósfera y las moléculas que juegan un papel en él.	Mientras sea en la troposfera es bueno porque en esta zona el ozono contribuye al efecto invernadero. Lucy Carpenter investiga el ciclo océano-atmósfera y las moléculas que juegan un papel en él.	https://royalsociety.org/~/media/people/medallists-2015/Lucy-Carpenter-550.jpg	
¿Qué efecto tienen los halocarbonos sobre el ozono?	Lo destruyen	Lo crean	Lo transforman en ozono no tóxico	Los halocarbonos son emitidos por el océano y destruyen ozono.  Lucy Carpenter investiga el ciclo océano-atmósfera y las moléculas que juegan un papel en él.	Los halocarbonos son emitidos por el océano y destruyen ozono.  Lucy Carpenter investiga el ciclo océano-atmósfera y las moléculas que juegan un papel en él.	Los halocarbonos son emitidos por el océano y destruyen ozono.  Lucy Carpenter investiga el ciclo océano-atmósfera y las moléculas que juegan un papel en él.	ozono.jpg	
¿Qué elemento debido a la contaminación se ha encontrado en el cerebro de calderones varados? 🐋	Mercurio	Uranio	Plutonio	Zuzana Gajdosechova ha estudiado el efecto del mercurio en el cerebro e hígado de calderones (cetáceos).	Zuzana Gajdosechova ha estudiado el efecto del mercurio en el cerebro e hígado de calderones (cetáceos).	Zuzana Gajdosechova ha estudiado el efecto del mercurio en el cerebro e hígado de calderones (cetáceos).	https://upload.wikimedia.org/wikipedia/commons/7/76/Pilot_whale_spyhop.jpg	
¿Cuál es una de las utilidades de los isótopos radiactivos? ☢	Medicina nuclear	Elaboración de transgénicos	Tejidos para trajes de astronautas	Se pueden utilizar pequeñas cantidades de isótopos radioactivos, inyectados o como "comida", para diagnosticar algunas enfermedades. Elizabeth Rona fue una de pioneros que los descubrieron y la que acuñó el término "marcadores radiactivos".	Se pueden utilizar pequeñas cantidades de isótopos radioactivos, inyectados o como "comida", para diagnosticar algunas enfermedades. Elizabeth Rona fue una de pioneros que los descubrieron y la que acuñó el término "marcadores radiactivos".	Se pueden utilizar pequeñas cantidades de isótopos radioactivos, inyectados o como "comida", para diagnosticar algunas enfermedades. Elizabeth Rona fue una de pioneros que los descubrieron y la que acuñó el término "marcadores radiactivos".	pet.jpg	
¿Qué son los isótopos? 	Átomos de un mismo elemento, con una cantidad diferente de neutrones	Bebidas para después del deporte	Átomos de un mismo elemento, con una cantidad diferente de electrones	Los distintos isótopos de un elemento tienen distinto número de neutrones. Una de las primeras personas en demostrar su existencia fue Ellen Gleditsch, asistente de Marie Curie.	Los distintos isótopos de un elemento tienen distinto número de neutrones. Una de las primeras personas en demostrar su existencia fue Ellen Gleditsch, asistente de Marie Curie.	Los distintos isótopos de un elemento tienen distinto número de neutrones. Una de las primeras personas en demostrar su existencia fue Ellen Gleditsch, asistente de Marie Curie.	https://upload.wikimedia.org/wikipedia/commons/thumb/3/3b/Ellen_Gleditsch.JPG/220px-Ellen_Gleditsch.JPG	
¿Quién acuñó el término "radiactividad"? ☢	Marie Curie	Lise Meitner	Carrie Fisher	Marie Curie, la única persona con dos Nobel en dos disciplinas científicas, física y química, fue pionera en los estudios de radiactividad. 	Marie Curie, la única persona con dos Nobel en dos disciplinas científicas, física y química, fue pionera en los estudios de radiactividad. 	Marie Curie, la única persona con dos Nobel en dos disciplinas científicas, física y química, fue pionera en los estudios de radiactividad. 	https://cdn2.newsok.biz/cache/r960-bdb2b27b5da982836ac1b9da501d7902.jpg	
¿Podemos usar los virus para fines científicos?	Sí, por ejemplo, amplificar ADN	¡No! Los virus son muy peligrosos	Se usan para reducir ADN	La enzima ADN Polimerasa del virus bacteriófagoΦ29 se usa para amplificar ADN. La bioquímica Margarita Salas fue pionera en su caracterización.	La enzima ADN Polimerasa del virus bacteriófagoΦ29 se usa para amplificar ADN. La bioquímica Margarita Salas fue pionera en su caracterización.	La enzima ADN Polimerasa del virus bacteriófagoΦ29 se usa para amplificar ADN. La bioquímica Margarita Salas fue pionera en su caracterización.	MargaritaSalas.jpg	
¿Cómo se "lee" el ADN?	Siempre en la misma dirección	En sentido antihorario	Con google translate	La bioquímica Margarita Salas determinó que el ADN se "lee" siempre en la dirección 5' - 3' (cinco prima - tres prima). Este descubrimiento tiene múltiples aplicaciones hoy en día.	La bioquímica Margarita Salas determinó que el ADN se "lee" siempre en la dirección 5' - 3' (cinco prima - tres prima). Este descubrimiento tiene múltiples aplicaciones hoy en día.	Tal vez algún día. ;) La bioquímica Margarita Salas determinó que el ADN se "lee" siempre en la dirección 5' - 3' (cinco prima - tres prima). Este descubrimiento tiene múltiples aplicaciones hoy en día.	ADN.jpg	
								
								
								
Matemáticas								
¿Quién ha sido la única mujer galardonada con la Medalla Fields (el "Nobel de las Matemáticas")?	Maryam Mirzakhani	Sofia Kovalevskaya	Sophie Germain	Maryam Mirzakhani la recibió en 2014 por sus descubrimientos en geometría. "Es un gran honor. Seré feliz si anima a mujeres jóvenes. Estoy segura de que habrá muchas más."	Maryam Mirzakhani la recibió en 2014 por sus descubrimientos en geometría. "Es un gran honor. Seré feliz si anima a mujeres jóvenes. Estoy segura de que habrá muchas más."	Maryam Mirzakhani la recibió en 2014 por sus descubrimientos en geometría. "Es un gran honor. Seré feliz si anima a mujeres jóvenes. Estoy segura de que habrá muchas más."	https://media.newyorker.com/photos/596d3b7a25778a3e4d191cd7/master/w_727,c_limit/Roberts-Maryam-Mirzakhanis-Pioneering-Mathematical-Legacy.jpg	
¿Qué es la transformada de ondículas (wavelets)?	Un tipo de transformada que analiza señales en tiempo-frecuencia	Una transformada espacio-temporal	Una transformada para las ondas de radio pequeñas	Las ondículas se han convertido en una herramienta fundamental de matemáticas aplicadas modernas en gran parte gracias al trabajo de la matemática Ingrid Daubechies.	Las ondículas se han convertido en una herramienta fundamental de matemáticas aplicadas modernas en gran parte gracias al trabajo de la matemática Ingrid Daubechies.	Las ondículas se han convertido en una herramienta fundamental de matemáticas aplicadas modernas en gran parte gracias al trabajo de la matemática Ingrid Daubechies.	http://helmut.knaust.info/presentations/2009/20091016_DWT/jpg/Daubechies.jpg	
En los sistemas descritos por la teoría del caos, un pequeño cambio...	En las condiciones iniciales supone un cambio enorme en las finales	Mejoraría mucho los resultados	En los parámetros cambiaría mucho las ecuaciones	La matemática Mary Cartwright fue junto a J. E. Littlewood de las primeras en estudiar lo que hoy se conoce por teoría del caos.	La matemática Mary Cartwright fue junto a J. E. Littlewood de las primeras en estudiar lo que hoy se conoce por teoría del caos.	La matemática Mary Cartwright fue junto a J. E. Littlewood de las primeras en estudiar lo que hoy se conoce por teoría del caos.	https://upload.wikimedia.org/wikipedia/commons/b/b4/Verhulst-Mandelbrot-Bifurcation.jpg	
¿De qué trata la teoría de la computabilidad?	De los problemas de decisión que pueden ser resueltos con un algoritmo	De cómo realizar operaciones	De la resolución de ecuaciones por métodos elementales	La matemática Rózsa Péter es considerada como la madre fundadora de la teoría de la computabilidad.	La matemática Rózsa Péter es considerada como la madre fundadora de la teoría de la computabilidad.	La matemática Rózsa Péter es considerada como la madre fundadora de la teoría de la computabilidad.	https://upload.wikimedia.org/wikipedia/commons/7/7e/RozsaPeter.jpg	
¿Se puede "oír la forma de un tambor" (deducir la forma exacta a partir del sonido que produce)?	No	Sí	Sólo para "tambores bidimensionales"	Carolyn S. Gordon descubrió junto a dos colegas en 1992 un par de formas con el mismo espectro de frecuencias (mismo "sonido"), respondiendo negativamente a esta vieja pregunta matemática.	Carolyn S. Gordon descubrió junto a dos colegas en 1992 un par de formas con el mismo espectro de frecuencias (mismo "sonido"), respondiendo negativamente a esta vieja pregunta matemática.	Carolyn S. Gordon descubrió junto a dos colegas en 1992 un par de formas con el mismo espectro de frecuencias (mismo "sonido"), respondiendo negativamente a esta vieja pregunta matemática.	drums.jpg	
La geometría algebraica...	Relaciona soluciones de polinomios con objetos geométricos	Funciona al revés que el álgebra geométrica	Se ocupa de las curvas que aparecen en las operaciones algebraicas	Su estudio comenzó con los matemáticos árabes y fue impulsado por Descartes. Claire Voisin es una de las mayores expertas actuales.	Su estudio comenzó con los matemáticos árabes y fue impulsado por Descartes. Claire Voisin es una de las mayores expertas actuales.	Su estudio comenzó con los matemáticos árabes y fue impulsado por Descartes. Claire Voisin es una de las mayores expertas actuales.	https://c2.staticflickr.com/4/3490/3285386791_e0c0889a10_b.jpg	
El "problema de los diez martinis"...	Va del comportamiento de los "operadores de Schrödinger"	Empieza en realidad a los nueve	Es un conocido problema de álgebra lineal	La matemática Svetlana Jitomirskaya resolvió junto a Artur Avila en 2005 este problema planteado por el físico matemático Barry Simon, que ofreció dichos martinis.	La matemática Svetlana Jitomirskaya resolvió junto a Artur Avila en 2005 este problema planteado por el físico matemático Barry Simon, que ofreció dichos martinis.	La matemática Svetlana Jitomirskaya resolvió junto a Artur Avila en 2005 este problema planteado por el físico matemático Barry Simon, que ofreció dichos martinis.	https://upload.wikimedia.org/wikipedia/commons/thumb/4/47/Hofstadter%27s_butterfly.png/320px-Hofstadter%27s_butterfly.png	
¿Qué estudia la teoría de nudos?	La topología del encaje de círculos en un espacio tridimensional	Las soluciones de ecuaciones particularmente enrevesadas	Los encajes de homomorfismos	La teoría de nudos tiene relación con la de grafos y también aparece en ciertas ramas de la física. El libro "Braids, Links, and Mapping Class Groups" de Joan Birman es una introducción estándar para investigadores.	La teoría de nudos tiene relación con la de grafos y también aparece en ciertas ramas de la física. El libro "Braids, Links, and Mapping Class Groups" de Joan Birman es una introducción estándar para investigadores.	La teoría de nudos tiene relación con la de grafos y también aparece en ciertas ramas de la física. El libro "Braids, Links, and Mapping Class Groups" de Joan Birman es una introducción estándar para investigadores.	https://enradianes.files.wordpress.com/2017/12/knotts.jpg	
"Los primos de Germain" son:	Un tipo de números primos	Una familia de matemáticos	Números que parecen primos, pero no lo son	Sophie Germain fue una física, matemática y filósofa que descubrió un tipo de números primos cuyo doble incrementado en una unidad es también un número primo.	Sophie Germain fue una física, matemática y filósofa que descubrió un tipo de números primos cuyo doble incrementado en una unidad es también un número primo.	Sophie Germain fue una física, matemática y filósofa que descubrió un tipo de números primos cuyo doble incrementado en una unidad es también un número primo.	germain.jpg	
¿Quién de estas divulgadoras no es matemática?	Natalia Ruiz Zelmanovitch	Clara Grima Ruiz	Marta Macho Stadler	Clara Grima y Marta Macho son matemáticas y divulgadoras. Natalia Ruiz Zelmanovitch es traductora y está especializada en divulgación de astronomía. 	Clara Grima y Marta Macho son matemáticas y divulgadoras. Natalia Ruiz Zelmanovitch es traductora y está especializada en divulgación de astronomía. 	Clara Grima y Marta Macho son matemáticas y divulgadoras. Natalia Ruiz Zelmanovitch es traductora y está especializada en divulgación de astronomía. 	divulgadoras.jpg	
"La bruja de Agnesi":	Es una curva	Es una matemática malvada	Es una fórmula matemática	Llama "bruja" por un error de traducción, la curva de Agnesi sirve para describir fenómenos de resonancia. Fue descubierta por la matemática italiana Maria Gaetana Agnesi. 	Llama "bruja" por un error de traducción, la curva de Agnesi sirve para describir fenómenos de resonancia. Fue descubierta por la matemática italiana Maria Gaetana Agnesi. 	Llama "bruja" por un error de traducción, la curva de Agnesi sirve para describir fenómenos de resonancia. Fue descubierta por la matemática italiana Maria Gaetana Agnesi. 	agnesi.jpg	
El conjunto de los números reales con la multiplicación es...	Un grupo, si excluimos al cero	Un grupo, si incluímos al cero	Un grupo en cualquier caso	Los grupos son estructuras en álgebra que se estudian en teoría de grupos. Maria Wonenburger fue una matemática española especializada en este área.	Los grupos son estructuras en álgebra que se estudian en teoría de grupos. Maria Wonenburger fue una matemática española especializada en este área.	Los grupos son estructuras en álgebra que se estudian en teoría de grupos. Maria Wonenburger fue una matemática española especializada en este área.	wonenburger.jpg	
								
Ciencias Naturales								
¿Qué estructura tiene el ADN?	Una doble hélice	Un hipercubo	Una esfera achatada	El ADN o "ácido desoxirribonucleico" es una molécula que se encuentra en el interior de las células y codifica la información genética. Los trabajos de Rosalind Franklin en difracción de rayos X del ADN llevaron al descubrimiento de su estructura. 	El ADN o "ácido desoxirribonucleico" es una molécula que se encuentra en el interior de las células y codifica la información genética. Los trabajos de Rosalind Franklin en difracción de rayos X del ADN llevaron al descubrimiento de su estructura. 	El ADN o "ácido desoxirribonucleico" es una molécula que se encuentra en el interior de las células y codifica la información genética. Los trabajos de Rosalind Franklin en difracción de rayos X del ADN llevaron al descubrimiento de su estructura. 	dna.jpg	
La "era de los dinosaurios" ocurrió durante...	El Mesozoico	El Paleozoico	El Cenozoico	Si volvemos atrás 250 millones de años, la Tierra estaba dominada por los dinosaurios. Lo descubrimos gracias a los cazadores de fósiles, entre los que destacan Mary Anning.	Justo después. Si volvemos atrás 250 millones de años la Tierra, durante el Mesozoico, estaba dominada por los dinosaurios. Lo descubrimos gracias a los cazadores de fósiles, entre los que destacan Mary Anning.	Justo antes. Si volvemos atrás 250 millones de años la Tierra, durante el Mesozoico, estaba dominada por los dinosaurios. Lo descubrimos gracias a los cazadores de fósiles, entre los que destacan Mary Anning.	mesozoico.jpg	
La parte más interna de la Tierra...	Es un núcleo sólido	Es un núcleo líquido	Es hueca y viven animales gigantes	La sismóloga y geofísica Inge Lehmann diseñó el experimento que permitió saber que la parte más interna de la Tierra es una esfera sólida de una aleación de hierro y níquel.	Una capa líquida recubre un núcleo sólido. La sismóloga y geofísica Inge Lehmann diseñó el experimento que permitió saber que la parte más interna de la Tierra es una esfera sólida de una aleación de hierro y níquel.	Molaría, pero no. La sismóloga y geofísica Inge Lehmann diseñó el experimento que permitió saber que la parte más interna de la Tierra es una esfera sólida de una aleación de hierro y níquel.	https://sunearthday.nasa.gov/2012/images/art_earthinterior_hires.jpg	
¿Qué describe el ciclo de Cori?	La circulación cíclica de la glucosa y el lactato entre el músculo y el hígado	La circulación cíclica de la glucosa y la dopamina en el cerebro	La circulación cíclica de la glucosa y la serotonina entre el músculo y el corazón	El ciclo de Cori es la circulación cíclica de la glucosa y el lactato entre el músculo y el hígado. Fue descubierto por Gerti Cori y su marido Carl, por lo que se llevaron el Nobel.	El ciclo de Cori es la circulación cíclica de la glucosa y el lactato entre el músculo y el hígado. Fue descubierto por Gerti Cori y su marido Carl, por lo que se llevaron el Nobel.	El ciclo de Cori es la circulación cíclica de la glucosa y el lactato entre el músculo y el hígado. Fue descubierto por Gerti Cori y su marido Carl, por lo que se llevaron el Nobel.	https://nameberry.com/blog/wp-content/uploads/2010/03/scifem5-319x383.jpg	
Niveles bajos de dopamina están asociados a...	Pérdida de memoria	Hiperactividad	Autismo	Niveles bajos de dopamina están asociados con varios problemas cerebrales, como la pérdida de memoria o enfermedades como el Alzheimer. La descubridora de la asociación fue la neurocientífica Pat Goldman-Rakic.	Niveles bajos de dopamina están asociados con varios problemas cerebrales, como la pérdida de memoria o enfermedades como el Alzheimer. La descubridora de la asociación fue la neurocientífica Pat Goldman-Rakic.	Niveles bajos de dopamina están asociados con varios problemas cerebrales, como la pérdida de memoria o enfermedades como el Alzheimer. La descubridora de la asociación fue la neurocientífica Pat Goldman-Rakic.	mind.jpg	
La primera evidencia de que no solo los seres humanos usamos herramientas vino de...	Ver chimpancés "pescando" termitas con un palo	Descubrir gorilas cazando con palos	La observación de delfines con corales como trampas para peces	Jane Goodall fue la primera persona en documentar el uso de herramientas por chimpancés. Su jefe diría "ahora tenemos que cambiar la definición de herramienta... o humano".	Jane Goodall fue la primera persona en documentar el uso de herramientas por chimpancés. Su jefe diría "ahora tenemos que cambiar la definición de herramienta... o humano".	Jane Goodall fue la primera persona en documentar el uso de herramientas por chimpancés. Su jefe diría "ahora tenemos que cambiar la definición de herramienta... o humano".	http://i1-news.softpedia-static.com/images/news2/Chimps-Catch-On-The-Way-Humans-Do-2.jpg	
