	Este fichero es el que lee SdC (exportado a tsv con File -> Download as -> Tab-separated values y renombrado como contents.tsv).							
								
	Cualquier fila con la primera casilla vacía es ignorada por el programa. Para comentarios y demás.							
	En una fila con contenido, la primera casilla es para la pregunta, 3 para las respuestas, 3 para sus comentarios y 1 para la imagen asociada.							
	Si sólo la primera casilla está llena, indica el comienzo de una nueva categoría.							
								
	Borrador de preguntas:	https://docs.google.com/spreadsheets/d/1h3KgxQoQhvGUW2ph2jCXoCwTmlB7LuenmH0La0JTmjU/edit#gid=0						
								
	Para buscar imágenes se puede usar la búsqueda avanzada de imágenes de google con "aspect ratio: tall" y "usage rights: free to use or share, even comercially" (por ejemplo, https://www.google.es/search?as_st=y&tbm=isch&hl=en&as_q=chaos+theory&as_epq=&as_oq=&as_eq=&cr=&as_sitesearch=&safe=images&tbs=iar:t,sur:fc )							
								
	Para coger emojis:	https://unicode.org/emoji/charts/full-emoji-list.html						
								
								
	Respuesta correcta	Respuesta 2	Respuesta 3	Comentario 1	Comentario 2	Comentario 3	Imagen	Notas sobre la pregunta
								
Física								
¿Qué interacciones conservan la simetría de paridad (se comportan igual que su imagen especular)?	Todas menos la débil	Las interacciones nucleares fuertes	Todas menos la electromagnética	El equipo dirigido por la física Chien-Shiung Wu descubrió en 1957 que las interacciones débiles violan la simetría de paridad, estudiando la desintegración beta del cobalto-60.	Las interacciones débiles no conservan la simetría de paridad, como demostró la física Chien-Shiung Wu en un famoso experimento sobre la desintegración beta del cobalto-60.	La interacción electromagnética conserva la paridad. Sin embargo la débil no lo hace.	wu.jpg	
¿Qué teorema asocia las simetrías de la acción con leyes de conservación?	El teorema de Noether	El teorema de Fermat	El teorema del virial	El teorema de Noether, demostrado por la matemática Emmy Noether en 1915, aclara el origen de leyes como la conservación de la energía, a partir de simetrías en las ecuaciones que describen un sistema.	El teorema de Noether, demostrado por la matemática Emmy Noether en 1915, aclara el origen de leyes como la conservación de la energía, a partir de simetrías en las ecuaciones que describen un sistema.	El teorema de Noether, demostrado por la matemática Emmy Noether en 1915, aclara el origen de leyes como la conservación de la energía, a partir de simetrías en las ecuaciones que describen un sistema.	Noether.jpg	
¿Quién es conocida como "la reina del carbón"? 👑	Mildred Dresselhaus	Cameron Howe	Jocelyn Bell	Dresselhaus fue la primera mujer catedrática del MIT. Se especializó en investigar la estructura del carbono y sus aplicaciones, incluyendo el potencial de la nanotecnología.	Dresselhaus fue la primera mujer catedrática del MIT. Se especializó en investigar la estructura del carbono y sus aplicaciones, incluyendo el potencial de la nanotecnología.	Dresselhaus fue la primera mujer catedrática del MIT. Se especializó en investigar la estructura del carbono y sus aplicaciones, incluyendo el potencial de la nanotecnología.	https://alum.mit.edu/sites/default/files/slice/uploads/2017/02/02-23-17_Millie-lego.png	
¿Qué es la fisión nuclear? ⚛	La división del núcleo en otros núcleos	La creación de un nuevo átomo por la unión de varios núcleos	El mecanismo por el que las estrellas producen energía	La fisión ocurre cuando un núcleo pesado se divide en dos o más núcleos más pequeños. La descubrieron Lisa Meitner y Otto Hahn. Solo Hahn se llevó el Nobel por ello. 	La fisión ocurre cuando un núcleo pesado se divide en dos o más núcleos más pequeños. La descubrieron Lisa Meitner y Otto Hahn. Solo Hahn se llevó el Nobel por ello. 	La fisión ocurre cuando un núcleo pesado se divide en dos o más núcleos más pequeños. La descubrieron Lisa Meitner y Otto Hahn. Solo Hahn se llevó el Nobel por ello. 	Lise Meitner Eva von Bahr.jpg	
¿Cuál de estos es un tipo de quark? 	Encantado	Honrado	Enamorado	Los quarks son partículas fundamentales y hay seis tipos distintos. Uno de ellos es el "encantado" (charm). Su descubrimiento fue posible en parte gracias al trabajo de la física Sau Lan Wu.	Los quarks son partículas fundamentales y hay seis tipos distintos. Uno de ellos es el "encantado" (charm). Su descubrimiento fue posible en parte gracias al trabajo de la física Sau Lan Wu.	Los quarks son partículas fundamentales y hay seis tipos distintos. Uno de ellos es el "encantado" (charm). Su descubrimiento fue posible en parte gracias al trabajo de la física Sau Lan Wu.	https://vq.vassar.edu/issues/2014/03/images/Sau-Lan-Wu-c.png	
¿Cuál de estos métodos se puede usar para detectar partículas?	Placas de emulsión nuclear	Cámaras de energía oscura	Neuralizadores	Marietta Blau y su estudiante Hertha Wambacher desarrollaron esta técnica de emulsión fotográfica y la utilizaron en el estudio de rayos cósmicos. Supuso un avance enorme en física de partículas. 	Marietta Blau y su estudiante Hertha Wambacher desarrollaron esta técnica de emulsión fotográfica y la utilizaron en el estudio de rayos cósmicos. Supuso un avance enorme en física de partículas. 	Marietta Blau y su estudiante Hertha Wambacher desarrollaron esta técnica de emulsión fotográfica y la utilizaron en el estudio de rayos cósmicos. Supuso un avance enorme en física de partículas. 	https://apod.nasa.gov/apod/image/0608/crshower2_nasa_big.jpg	
¿Qué es el bosón de Higgs?	Una partícula que tiene que ver con cómo se crea la materia	Una partícula bosonuda	La primera partícula de antimateria descubierta	El bosón de Higgs es un tipo de partícula elemental que tiene un papel fundamental en el mecanismo por el que se origina la masa. Se detectó gracias a dos experimentos en el CERN, uno de ellos liderado por Fabiola Gianotti. Ella misma anunció el descubrimiento en 2012. 	El bosón de Higgs es un tipo de partícula elemental que tiene un papel fundamental en el mecanismo por el que se origina la masa. Se detectó gracias a dos experimentos en el CERN, uno de ellos liderado por Fabiola Gianotti. Ella misma anunció el descubrimiento en 2012. 	El bosón de Higgs es un tipo de partícula elemental que tiene un papel fundamental en el mecanismo por el que se origina la masa. Se detectó gracias a dos experimentos en el CERN, uno de ellos liderado por Fabiola Gianotti. Ella misma anunció el descubrimiento en 2012. 	https://pbs.twimg.com/profile_images/821769892894539778/cWanEnDN.jpg	
¿Para qué se puede utilizar un haz de positronio?	Para desvelar la estructura de átomos y moléculas	Para conquistar el universo	Para mantenerse siempre positivo	Gaetana Laricchia y su grupo es pionera en física de positrones. Han desarrollado el único haz en el mundo de positronio con el que están estudiando propiedades atómicas. 	Gaetana Laricchia y su grupo es pionera en física de positrones. Han desarrollado el único haz en el mundo de positronio con el que están estudiando propiedades atómicas. 	Gaetana Laricchia y su grupo es pionera en física de positrones. Han desarrollado el único haz en el mundo de positronio con el que están estudiando propiedades atómicas. 	https://cdn.shopify.com/s/files/1/1708/0909/products/positron1.jpg	
¿Es posible "frenar" la luz?	Sí	No	Solo si eres Dazzler	Sí es posible y un caso extremo lo consiguió la física danesa Lene Hau. Lo hizo utilizando un "condensado Bose-Einstein", un extraño estado de la materia. 	Sí es posible y un caso extremo lo consiguió la física danesa Lene Hau. Lo hizo utilizando un "condensado Bose-Einstein", un extraño estado de la materia. 	Sí es posible y un caso extremo lo consiguió la física danesa Lene Hau. Lo hizo utilizando un "condensado Bose-Einstein", un extraño estado de la materia. 	Professor_Lene_Hau_in_her_laboratory_at_Harvard.jpg	
¿Cuál de estos es un tipo de quark?	Top	Crack	Bajito	Los quarks son partículas fundamentales y hay seis tipos distintos. Uno de ellos es el "top". Su descubrimiento fue posible en parte gracias al equipo de la física Melissa Franklin.	Los quarks son partículas fundamentales y hay seis tipos distintos. Uno de ellos es el "top". Su descubrimiento fue posible en parte gracias al equipo de la física Melissa Franklin.	Los quarks son partículas fundamentales y hay seis tipos distintos. Uno de ellos es el "top". Su descubrimiento fue posible en parte gracias al equipo de la física Melissa Franklin.	http://www2.lbl.gov/Science-Articles/Archive/assets/images/2004/Jun-10/top_quark.jpg	
El sol es una estrella de clase... ☀	G, una enana amarilla	B, una supergigante verde	O, una gigante azul	Annie Jump Cannon fue la astrónoma que ideó la clasificación de estrellas con las letras O-B-A-F-G-K-M, relacionada con la temperatura de las estrellas. Fue una de "las computadoras de Harvard".	Annie Jump Cannon fue la astrónoma que ideó la clasificación de estrellas con las letras O-B-A-F-G-K-M, relacionada con la temperatura de las estrellas. Fue una de "las computadoras de Harvard".	Annie Jump Cannon fue la astrónoma que ideó la clasificación de estrellas con las letras O-B-A-F-G-K-M, relacionada con la temperatura de las estrellas. Fue una de "las computadoras de Harvard".	sun.jpg	
¿De qué están compuestas las estrellas mayoritariamente? ⭐	Hidrógeno y helio	Carbono y oxígeno	Hidrógeno y carbono	Cecilia Payne lo descubrió mientras hacía su tesis, considerada la mejor de astrofísica en su momento.	Cecilia Payne lo descubrió mientras hacía su tesis, considerada la mejor de astrofísica en su momento.	Cecilia Payne lo descubrió mientras hacía su tesis, considerada la mejor de astrofísica en su momento.	sun.jpg	
Las estrellas más alejadas del centro de nuestra galaxia... ⭐	Giran más rápido de lo esperado	Giran más lento de lo esperado	No giran	Lo descubrió la astrónoma Vera Rubin y constituyó una de las primeras evidencias de la existencia de materia oscura. 	Lo descubrió la astrónoma Vera Rubin y constituyó una de las primeras evidencias de la existencia de materia oscura. 	Lo descubrió la astrónoma Vera Rubin y constituyó una de las primeras evidencias de la existencia de materia oscura. 	https://static01.nyt.com/images/2016/12/28/us/28rubin-obit-1/28rubin-obit-1-blog427.jpg	
La primera estrella enana marrón descubierta tiene una masa de...	55 veces la masa de Júpiter	5 veces la masa de Júpiter	555 veces la masa de Júpiter	Teide 1 se descubrió desde el Instituto Astrofísico de Canarias por Maria Rosa Zapatero, Rafael Rebolo y Eduardo Martín. Está en el cúmulo de las Pléyades. 	Más: 55 veces la masa de Júpiter. Teide 1 se descubrió desde el Instituto Astrofísico de Canarias por Maria Rosa Zapatero, Rafael Rebolo y Eduardo Martín. Está en el cúmulo de las Pléyades. 	Mucho menos: 55 veces la masa de Júpiter. Teide 1 se descubrió desde el Instituto Astrofísico de Canarias por Maria Rosa Zapatero, Rafael Rebolo y Eduardo Martín. Está en el cúmulo de las Pléyades. 	enana.jpg	
¿Cuántas lunas tiene Saturno? 🌗	Al menos 62	Solo una	666	Carolyn Porco es la investigadora responsable del equipo de imágenes de la misión Cassini. Cassini estudió a Saturno, sus anillos y lunas (descubrió 7 nuevas).	Carolyn Porco es la investigadora responsable del equipo de imágenes de la misión Cassini. Cassini estudió a Saturno, sus anillos y lunas (descubrió 7 nuevas).	Carolyn Porco es la investigadora responsable del equipo de imágenes de la misión Cassini. Cassini estudió a Saturno, sus anillos y lunas (descubrió 7 nuevas).	saturn.jpg	
¿En cuál de estas lunas hemos visto lagos de hidrocarburos?  🌙	Titán, luna de Saturno	Deimos, luna de Marte	Ío, luna de Júpiter	Los lagos fueron descubiertos en los polos por la misión Cassini. La investigadora responsable del equipo de imágenes es Carolyn Porco.	No, fue en Titán. Los lagos fueron descubiertos en los polos por la misión Cassini. La investigadora responsable del equipo de imágenes es Carolyn Porco.	No, fue en Titán. Los lagos fueron descubiertos en los polos por la misión Cassini. La investigadora responsable del equipo de imágenes es Carolyn Porco.	titan.jpg	
¿Cuántas estrellas con varios planetas se han descubierto directamente hasta ahora? 🌟	Más de 500	Más de 5000	Entre 50 y 100	En 1999 se descubrió la primera estrella con varios planetas. Entre las descubridoras estaba Debra Fischer, una de las mayores expertas en planetas extrasolares. 	En 1999 se descubrió la primera estrella con varios planetas. Entre las descubridoras estaba Debra Fischer, una de las mayores expertas en planetas extrasolares. 	En 1999 se descubrió la primera estrella con varios planetas. Entre las descubridoras estaba Debra Fischer, una de las mayores expertas en planetas extrasolares. 	http://planetary.s3.amazonaws.com/assets/images/exoplanets/20170222_trappist-habitable-zone-3d.jpg	
¿Dónde está el telescopio Hubble? 🔭	En el espacio	En Canarias	En Arecibo	El telescopio espacial fue posible gracias a la "madre del Hubble", Nancy Roman.	El telescopio espacial fue posible gracias a la "madre del Hubble", Nancy Roman.	El telescopio espacial fue posible gracias a la "madre del Hubble", Nancy Roman.	http://www.stecf.org/conferences/HST3/presentations/mon_s_1/Hubble%20History/Nancy%20Roman.jpeg	
¿Quién fue la primera mujer en el espacio? 👩🏼‍🚀	Valentina Tereshkova	Sally Ride	Valentina Kerbal	¡Valentina Tereshkova hizo historia con solo 23 años! Orbitó la Tierra durante 3 días.	¡Valentina Tereshkova hizo historia con solo 23 años! Orbitó la Tierra durante 3 días.	¡Valentina Tereshkova hizo historia con solo 23 años! Orbitó la Tierra durante 3 días.	valentina.jpg	
¿Cuántas mujeres astronautas ha habido? 👩🏿‍🚀	Más de 60	Entre 20 y 60	Menos de 20	¡Y cada vez el número crece más rápido! En 2013 de los 6 nuevos astronautas elegidos por la NASA, 3 eran mujeres.	¡Y cada vez el número crece más rápido! En 2013 de los 6 nuevos astronautas elegidos por la NASA, 3 eran mujeres.	¡Y cada vez el número crece más rápido! En 2013 de los 6 nuevos astronautas elegidos por la NASA, 3 eran mujeres.	astronautas.jpg	
¿Qué es un púlsar?	El núcleo muy denso que queda después de que ciertas estrellas colapsen	Una estrella muy grande hecha de antimateria	Dos agujeros negros conectados	Algunas estrellas muy grandes acaban su vida en una explosión. El resto de esta explosión puedes ser un púlsar, un objeto superconcentrado que emite pulsos de luz. Los descubrió la astrónoma Jocelyn Bell. 	Algunas estrellas muy grandes acaban su vida en una explosión. El resto de esta explosión puedes ser un púlsar, un objeto superconcentrado que emite pulsos de luz. Los descubrió la astrónoma Jocelyn Bell. 	Algunas estrellas muy grandes acaban su vida en una explosión. El resto de esta explosión puedes ser un púlsar, un objeto superconcentrado que emite pulsos de luz. Los descubrió la astrónoma Jocelyn Bell. 	pulsar.jpg	
¿Quién descubrió la nebulosa Cabeza de Caballo?	Mina Fleming	Cecilia Payne	Maria Mitchell	Mina fue una de las primeras "Computadoras de Harvard" y descubrió muchas estrellas variables y nebulosas. 	Mina fue una de las primeras "Computadoras de Harvard" y descubrió muchas estrellas variables y nebulosas. 	Mina fue una de las primeras "Computadoras de Harvard" y descubrió muchas estrellas variables y nebulosas. 	https://pbs.twimg.com/profile_images/770295600298364928/D5NnAcDL.jpg	
¿Quién fue la primera mujer que descubrió un cometa? ☄	Maria Kirch	Caroline Herschel	Maria Mitchell	Durante años se pensó que había sido Caroline Herschel, porque el cometa de Kirch se atribuyó a su marido.	Durante años se pensó que había sido Caroline Herschel, porque el cometa de Kirch se atribuyó a su marido.	Durante años se pensó que había sido Caroline Herschel, porque el cometa de Kirch se atribuyó a su marido.	https://upload.wikimedia.org/wikipedia/commons/thumb/b/ba/Comet_Hale-Bopp_1995O1.jpg/1200px-Comet_Hale-Bopp_1995O1.jpg	
¿Quién de estas mujeres trabajó como computadora?	Maria Mitchell	Vera Rubin	Sally Ride	Maria Mitchell fue la primera astrónoma estadounidense que pudo dedicarse profesionalmente a ello. Trabajó durante años haciendo cálculos relacionados con las efemérides astronómicas y finalmente de profesora. 	Vera también fue una astrónoma, pero la que además trabajó como "computadora" fue Maria Mitchell, quien fue la primera astrónoma estadounidense que pudo dedicarse profesionalmente a ello. Trabajó durante años haciendo cálculos relacionados con las efemérides astronómicas y finalmente de profesora. 	Sally Ride fue la primera astronauta estadounidense. Maria Mitchell fue la primera astrónoma estadounidense que pudo dedicarse profesionalmente a ello. Trabajó durante años haciendo cálculos relacionados con las efemérides astronómicas y finalmente de profesora. 	http://fall10astronomy.providence.wikispaces.net/file/view/mitchell.jpg/185114603/mitchell.jpg	
¿Quién fue la primera estadounidense en el espacio? 👩🏼‍🚀	Sally Ride	Vera Rubin	Maria Mitchell	Sally Ride fue la primera estadounidense en el espacio. 	Sally Ride fue la primera estadounidense en el espacio. 	Sally Ride fue la primera estadounidense en el espacio. 	sally.jpg	
¿Quién fue la primera astronauta hispana? 👨🏾‍🚀	Ellen Ochoa	Gabriela González	Alicia Sintes	Ellen Ochoa es física y nieta de abuelos mexicanos. En 1993 salió al espacio por primera vez. Actualmente es directora de uno de los centros más importantes de la NASA.	Gabriela González es investigadora en ondas gravitacionales. Ellen Ochoa es física y nieta de abuelos mexicanos. En 1993 salió al espacio por primera vez. Actualmente es directora de uno de los centros más importantes de la NASA.	Alicia Sintes es investigadora en ondas gravitacionales. Ellen Ochoa es física y nieta de abuelos mexicanos. En 1993 salió al espacio por 1ª vez. Ahora es directora de uno de los centros más importantes de la NASA.	https://upload.wikimedia.org/wikipedia/commons/thumb/e/e8/Ellen_Ochoa.jpg/1200px-Ellen_Ochoa.jpg	
La primera evidencia de actividad volcánica fuera de nuestro planeta se descubrió en... 🌋	Ío, luna de Júpiter	Encélado, luna de Júpiter	Deimos, luna de Marte	El descubrimiento lo hizo en 1979 Linda Morabito, astrónoma trabajando en la misión Voyager. 	El descubrimiento lo hizo en 1979 Linda Morabito, astrónoma trabajando en la misión Voyager. 	El descubrimiento lo hizo en 1979 Linda Morabito, astrónoma trabajando en la misión Voyager. 	https://upload.wikimedia.org/wikipedia/commons/thumb/5/55/PIA01081-Color_Mosaic_and_Active_Volcanic_Plumes_on_Io.jpg/1200px-PIA01081-Color_Mosaic_and_Active_Volcanic_Plumes_on_Io.jpg	
¿Cuál de este tipo de estrellas sirven para medir distancias en el universo?	Las Cefeidas	Las enanas marrones	Las gigantes rojas	Henrietta Leavitt descubrió que la frecuencia con que cambian de brillo depende de su luminosidad, lo que permitió por primera vez medir distancias entre galaxias.	Henrietta Leavitt descubrió que la frecuencia con que cambian de brillo depende de su luminosidad, lo que permitió por primera vez medir distancias entre galaxias.	Henrietta Leavitt descubrió que la frecuencia con que cambian de brillo depende de su luminosidad, lo que permitió por primera vez medir distancias entre galaxias.	http://2.bp.blogspot.com/-hzq3JERK-kQ/UC_JLab24zI/AAAAAAAAEA4/fMFSHxqDQrY/s1600/Henrietta+Leavitt.jpg	
¿Cambian las galaxias de forma con el tiempo?	¡Claro!	Solo unas pocas	No, las galaxias, galaxias son estáticas	Beatrice Tinsley revolucionó el campo de la astronomía galáctica, estudiando como su forma y brillo cambia con el tiempo. 	Beatrice Tinsley revolucionó el campo de la astronomía galáctica, estudiando como su forma y brillo cambia con el tiempo. 	Beatrice Tinsley revolucionó el campo de la astronomía galáctica, estudiando como su forma y brillo cambia con el tiempo. 	https://space-facts.com/wp-content/uploads/andromeda-galaxy.jpg	
¿Cómo se pueden ver planetas en formación en estrellas parecidas al Sol?	Con telescopios infrarrojos	Con telescopios de Rayos X	Con muy buena vista y mucha suerte	Los planetas se forman a partir de anillos de "escombros" que hay alrededor de las estrellas. La primera en tomar una imagen de "protoplanetas" alrededor de una estrella parecida al sol fue Jane Greaves.	Los planetas se forman a partir de anillos de "escombros" que hay alrededor de las estrellas. La primera en tomar una imagen de "protoplanetas" alrededor de una estrella parecida al sol fue Jane Greaves.	Los planetas se forman a partir de anillos de "escombros" que hay alrededor de las estrellas. La primera en tomar una imagen de "protoplanetas" alrededor de una estrella parecida al sol fue Jane Greaves.	https://astrobites.org/wp-content/uploads/2015/05/141105_ALMA_HL_01.jpg	
Para detectar ondas gravitacionales se han utilizado...	Interferómetros láser	Telescopios infrarrojos	Trampas de materia oscura	 Sheila Rowan lidera uno de los equipos que ha contribuido a mejorar la increíble precisión necesaria en estos detectores. 	 Sheila Rowan lidera uno de los equipos que ha contribuido a mejorar la increíble precisión necesaria en estos detectores. 	 Sheila Rowan lidera uno de los equipos que ha contribuido a mejorar la increíble precisión necesaria en estos detectores. 	http://www.space.com/images/i/000/038/426/original/HiResLivingston_6.jpg	
								
								
								
Química								
	No más nombres!!							
¿Cuál de estos materiales se usa en chalecos antibalas?	Kevlar	Klystron	Tardiscon	El kevlar fue descubierto en 1871 por Stephanie Kwolek. Tiene numerosas aplicaciones, entre ellas las que lo hicieron uno de los materiales más usados para chalecos antibalas. 	El kevlar fue descubierto en 1871 por Stephanie Kwolek. Tiene numerosas aplicaciones, entre ellas las que lo hicieron uno de los materiales más usados para chalecos antibalas. 	El kevlar fue descubierto en 1871 por Stephanie Kwolek. Tiene numerosas aplicaciones, entre ellas las que lo hicieron uno de los materiales más usados para chalecos antibalas. 	batman.jpg	
El agujero de ozono fue causado principalmente por...	Clorofluorocarbonos 	Dióxido de carbono	Hidrocarburos aromáticos	En 1986 Susan Solomon publicó la demostración más contundente de que los CFC eran los responsables del agujero de ozono. En 1995 se concedió el Nobel por este tema. A ella se le mencionó en la descripción del premio. 	En 1986 Susan Solomon publicó la demostración más contundente de que los CFC eran los responsables del agujero de ozono. En 1995 se concedió el Nobel por este tema. A ella se le mencionó en la descripción del premio. 	En 1986 Susan Solomon publicó la demostración más contundente de que los CFC eran los responsables del agujero de ozono. En 1995 se concedió el Nobel por este tema. A ella se le mencionó en la descripción del premio. 	https://www.chemheritage.org/sites/default/files/styles/rte_full_width/public/bio-solomonantarctica.jpg	
¿Quién descubrió el Francio? ☢	Marguerite Perey	Hipatia de Alejandria	Napoleón Bonaparte	Marguerite Catherine Perey descubrió el Francio en 1939. Después de este descubrimiento pudo conseguir una beca que le permitió ir a estudiar a la universidad. 	Marguerite Catherine Perey descubrió el Francio en 1939. Después de este descubrimiento pudo conseguir una beca que le permitió ir a estudiar a la universidad. 	Marguerite Catherine Perey descubrió el Francio en 1939. Después de este descubrimiento pudo conseguir una beca que le permitió ir a estudiar a la universidad. 	http://periodictable.com/Samples/087.4/s13.JPG	
¿Quién es considerada "la madre de la química moderna"?	Marie-Anne Lavoisier	Marie Curie	Cecilia Payne	Marie-Anne Lavoisier fue química y publicó las Memorias de Química de Lavoisier que sentaron las bases de la química moderna.	Marie-Anne Lavoisier fue química y publicó las Memorias de Química de Lavoisier que sentaron las bases de la química moderna.	Marie-Anne Lavoisier fue química y publicó las Memorias de Química de Lavoisier que sentaron las bases de la química moderna.	https://upload.wikimedia.org/wikipedia/commons/4/4e/David_-_Portrait_of_Monsieur_Lavoisier_and_His_Wife.jpg	
¿Quién descubrió la estructura de la penicilina, la vitamina B12 y la insulina humana? 💉	Dorothy Crowfoot Hodgkin	Alexander Fleming	Valentina Kerbal	Dorothy Crowfoot Hodgkin se llevó el Nobel de Química en 1964 por sus trabajos en técnicas de rayos X que le permitieron descubrir la estructura de varias moléculas. 	Dorothy Crowfoot Hodgkin se llevó el Nobel de Química en 1964 por sus trabajos en técnicas de rayos X que le permitieron descubrir la estructura de varias moléculas. 	Dorothy Crowfoot Hodgkin se llevó el Nobel de Química en 1964 por sus trabajos en técnicas de rayos X que le permitieron descubrir la estructura de varias moléculas. 	http://deskarati.com/wp-content/uploads/2011/04/dorothy_crowfoot_hodgkin.jpg	
